{
  "schemaVersion": 1,
  "admissionYear": 2025,
  "source": [
    {
      "title": "2025年度入学者用 学部学修案内",
      "url": "https://www.titech.ac.jp/guide/guide_2025/gakubu1/"
    }
  ],
  "departments": [
    {"id":"math","name":{"ja":"数学系","en":"Mathematics"},"syllabusScope":"1/0-901-311100-0-0","unitCode":"311100","guidePdf":"https://www.titech.ac.jp/guide/guide_2025/gakubu1/pdf/26-01.pdf","recommended":[]},
    {"id":"physics","name":{"ja":"物理学系","en":"Physics"},"syllabusScope":"1/0-901-311200-0-0","unitCode":"311200","guidePdf":"https://www.titech.ac.jp/guide/guide_2025/gakubu1/pdf/26-02.pdf","recommended":[]},
    {"id":"chemistry","name":{"ja":"化学系","en":"Chemistry"},"syllabusScope":"1/0-901-311300-0-0","unitCode":"311300","guidePdf":"https://www.titech.ac.jp/guide/guide_2025/gakubu1/pdf/26-03.pdf","recommended":[]},
    {"id":"eps","name":{"ja":"地球惑星科学系","en":"Earth and Planetary Sciences"},"syllabusScope":"1/0-901-311400-0-0","unitCode":"311400","guidePdf":"https://www.titech.ac.jp/guide/guide_2025/gakubu1/pdf/26-04.pdf","recommended":[]},
    {"id":"mech","name":{"ja":"機械系","en":"Mechanical Engineering"},"syllabusScope":"2/0-902-321500-0-0","unitCode":"321500","guidePdf":"https://www.titech.ac.jp/guide/guide_2025/gakubu1/pdf/26-05.pdf","recommended":[]},
    {"id":"sc","name":{"ja":"システム制御系","en":"Systems and Control Engineering"},"syllabusScope":"2/0-902-321600-0-0","unitCode":"321600","guidePdf":"https://www.titech.ac.jp/guide/guide_2025/gakubu1/pdf/26-06.pdf","recommended":[]},
    {"id":"ee","name":{"ja":"電気電子系","en":"Electrical and Electronic Engineering"},"syllabusScope":"2/0-902-321700-0-0","unitCode":"321700","guidePdf":"https://www.titech.ac.jp/guide/guide_2025/gakubu1/pdf/26-07.pdf","recommended":[]},
    {"id":"ict","name":{"ja":"情報通信系","en":"Information and Communications Engineering"},"syllabusScope":"2/0-902-321800-0-0","unitCode":"321800","guidePdf":"https://www.titech.ac.jp/guide/guide_2025/gakubu1/pdf/26-08.pdf","recommended":[]},
    {"id":"ie","name":{"ja":"経営工学系","en":"Industrial Engineering and Economics"},"syllabusScope":"2/0-902-321900-0-0","unitCode":"321900","guidePdf":"https://www.titech.ac.jp/guide/guide_2025/gakubu1/pdf/26-09.pdf","recommended":[]},
    {"id":"mat","name":{"ja":"材料系","en":"Materials Science and Engineering"},"syllabusScope":"3/0-903-332000-0-0","unitCode":"332000","guidePdf":"https://www.titech.ac.jp/guide/guide_2025/gakubu1/pdf/26-10.pdf","recommended":[]},
    {"id":"chem-eng","name":{"ja":"応用化学系","en":"Chemical Science and Engineering"},"syllabusScope":"3/0-903-332100-0-0","unitCode":"332100","guidePdf":"https://www.titech.ac.jp/guide/guide_2025/gakubu1/pdf/26-11.pdf","recommended":[]},
    {"id":"mcs","name":{"ja":"数理・計算科学系","en":"Mathematical and Computing Science"},"syllabusScope":"4/0-904-342200-0-0","unitCode":"342200","guidePdf":"https://www.titech.ac.jp/guide/guide_2025/gakubu1/pdf/26-12.pdf","recommended":[]},
    {
      "id":"cs",
      "name":{"ja":"情報工学系","en":"Computer Science"},
      "syllabusScope":"4/0-904-342300-0-0",
      "unitCode":"342300",
      "guidePdf":"https://www.titech.ac.jp/guide/guide_2025/gakubu1/pdf/26-13.pdf",
      "recommended":[
        {"category":{"ja":"専門科目","en":"Major courses"},"level":200,"code":"CSC.T241","group":"A","mark":"recommended","title":{"ja":"計算基礎論"},"credits":{"lecture":2.0,"exercise":0.0,"lab":0.0},"competencies":[1],"content":["a"],"note":"A群"},
        {"category":{"ja":"専門科目","en":"Major courses"},"level":200,"code":"CSC.T242","group":"A","mark":"recommended","title":{"ja":"確率論・統計学"},"credits":{"lecture":2.0,"exercise":0.0,"lab":0.0},"competencies":[1],"content":["a"],"note":"A群"},
        {"category":{"ja":"専門科目","en":"Major courses"},"level":200,"code":"CSC.T243","group":"C","mark":"recommended","title":{"ja":"手続き型プログラミング基礎"},"credits":{"lecture":2.0,"exercise":1.0,"lab":0.0},"competencies":[1,5],"content":["a","b"],"note":"C群"},
        {"category":{"ja":"専門科目","en":"Major courses"},"level":200,"code":"CSC.T244","group":"C","mark":"recommended","title":{"ja":"プログラミング創造演習"},"credits":{"lecture":0.0,"exercise":6.0,"lab":0.0},"competencies":[1,5],"content":["a","b"],"note":"C群"},
        {"category":{"ja":"専門科目","en":"Major courses"},"level":200,"code":"CSC.T251","group":"A","mark":"recommended","title":{"ja":"オートマトンと形式言語"},"credits":{"lecture":2.0,"exercise":0.0,"lab":0.0},"competencies":[1],"content":["a","b"],"note":"A群"},
        {"category":{"ja":"専門科目","en":"Major courses"},"level":200,"code":"CSC.T252","group":"A","mark":"recommended","title":{"ja":"論理回路理論"},"credits":{"lecture":2.0,"exercise":0.0,"lab":0.0},"competencies":[1],"content":["a"],"note":"A群"},
        {"category":{"ja":"専門科目","en":"Major courses"},"level":200,"code":"CSC.T253","group":"C","mark":"recommended","title":{"ja":"手続き型プログラミング発展"},"credits":{"lecture":2.0,"exercise":1.0,"lab":0.0},"competencies":[1,5],"content":["a","b"],"note":"C群"},
        {"category":{"ja":"専門科目","en":"Major courses"},"level":200,"code":"CSC.T254","group":"A","mark":"recommended","title":{"ja":"機械学習"},"credits":{"lecture":2.0,"exercise":0.0,"lab":0.0},"competencies":[1],"content":["a"],"note":"A群"},
        {"category":{"ja":"専門科目","en":"Major courses"},"level":200,"code":"CSC.T255","group":"B","mark":"recommended","title":{"ja":"組み合わせゲーム理論入門"},"credits":{"lecture":2.0,"exercise":0.0,"lab":0.0},"competencies":[1],"content":["a"],"note":"B群"},
        {"category":{"ja":"専門科目","en":"Major courses"},"level":200,"code":"CSC.T261","group":"A","mark":"recommended","title":{"ja":"情報論理"},"credits":{"lecture":2.0,"exercise":0.0,"lab":0.0},"competencies":[1,4,5],"content":["a","b"],"note":"A群"},
        {"category":{"ja":"専門科目","en":"Major courses"},"level":200,"code":"CSC.T262","group":"A","mark":"recommended","title":{"ja":"アセンブリ言語"},"credits":{"lecture":2.0,"exercise":0.0,"lab":0.0},"competencies":[1,5],"content":["a"],"note":"A群"},
        {"category":{"ja":"専門科目","en":"Major courses"},"level":200,"code":"CSC.T263","group":"C","mark":"recommended","title":{"ja":"関数型プログラミング基礎"},"credits":{"lecture":1.0,"exercise":1.0,"lab":0.0},"competencies":[1,5],"content":["a","b"],"note":"C群"},
        {"category":{"ja":"専門科目","en":"Major courses"},"level":200,"code":"CSC.T271","group":"A","mark":"recommended","title":{"ja":"データ構造とアルゴリズム"},"credits":{"lecture":2.0,"exercise":0.0,"lab":0.0},"competencies":[1,5],"content":["a","b"],"note":"A群"},
        {"category":{"ja":"専門科目","en":"Major courses"},"level":200,"code":"CSC.T272","group":"B","mark":"recommended","title":{"ja":"人工知能"},"credits":{"lecture":2.0,"exercise":0.0,"lab":0.0},"competencies":[1],"content":["a"],"note":"B群"},
        {"category":{"ja":"専門科目","en":"Major courses"},"level":200,"code":"CSC.T273","group":"C","mark":"recommended","title":{"ja":"オブジェクト指向プログラミング"},"credits":{"lecture":1.0,"exercise":1.0,"lab":0.0},"competencies":[1,5],"content":["a","b"],"note":"C群"},
        {"category":{"ja":"専門科目","en":"Major courses"},"level":300,"code":"CSC.T341","group":"A","mark":"recommended","title":{"ja":"コンピュータ論理設計"},"credits":{"lecture":2.0,"exercise":1.0,"lab":0.0},"competencies":[1,5],"content":["a","b"],"note":"A群"},
        {"category":{"ja":"専門科目","en":"Major courses"},"level":300,"code":"CSC.T342","group":"B","mark":"recommended","title":{"ja":"最適化基礎"},"credits":{"lecture":2.0,"exercise":0.0,"lab":0.0},"competencies":[1],"content":["a"],"note":"B群"},
        {"category":{"ja":"専門科目","en":"Major courses"},"level":300,"code":"CSC.T343","group":"B","mark":"recommended","title":{"ja":"データベース"},"credits":{"lecture":2.0,"exercise":0.0,"lab":0.0},"competencies":[1,5],"content":["a"],"note":"B群"},
        {"category":{"ja":"専門科目","en":"Major courses"},"level":300,"code":"CSC.T344","group":"B","mark":"recommended","title":{"ja":"システムプログラミング"},"credits":{"lecture":1.0,"exercise":1.0,"lab":0.0},"competencies":[1,5],"content":["a","b"],"note":"B群"},
        {"category":{"ja":"専門科目","en":"Major courses"},"level":300,"code":"CSC.T345","group":"B","mark":"recommended","title":{"ja":"コンピュータネットワーク"},"credits":{"lecture":2.0,"exercise":0.0,"lab":0.0},"competencies":[1],"content":["a"],"note":"B群"},
        {"category":{"ja":"専門科目","en":"Major courses"},"level":300,"code":"CSC.T351","group":"B","mark":"recommended","title":{"ja":"システム解析"},"credits":{"lecture":2.0,"exercise":0.0,"lab":0.0},"competencies":[1],"content":["a"],"note":"B群"},
        {"category":{"ja":"専門科目","en":"Major courses"},"level":300,"code":"CSC.T352","group":"B","mark":"recommended","title":{"ja":"パターン認識"},"credits":{"lecture":2.0,"exercise":0.0,"lab":0.0},"competencies":[1],"content":["a"],"note":"B群"},
        {"category":{"ja":"専門科目","en":"Major courses"},"level":300,"code":"CSC.T353","group":"B","mark":"recommended","title":{"ja":"生命情報解析"},"credits":{"lecture":2.0,"exercise":0.0,"lab":0.0},"competencies":[1,4],"content":["a"],"note":"B群"},
        {"category":{"ja":"専門科目","en":"Major courses"},"level":300,"code":"CSC.T354","group":"B","mark":"recommended","title":{"ja":"並列プログラミング"},"credits":{"lecture":1.0,"exercise":1.0,"lab":0.0},"competencies":[1,5],"content":["a","b"],"note":"B群"},
        {"category":{"ja":"専門科目","en":"Major courses"},"level":300,"code":"CSC.T361","group":"B","mark":"recommended","title":{"ja":"ソフトウェア設計と品質"},"credits":{"lecture":2.0,"exercise":0.0,"lab":0.0},"competencies":[1],"content":["a"],"note":"B群"},
        {"category":{"ja":"専門科目","en":"Major courses"},"level":300,"code":"CSC.T362","group":"B","mark":"recommended","title":{"ja":"数値計算法"},"credits":{"lecture":2.0,"exercise":0.0,"lab":0.0},"competencies":[1],"content":["a"],"note":"B群"},
        {"category":{"ja":"専門科目","en":"Major courses"},"level":300,"code":"CSC.T363","group":"B","mark":"recommended","title":{"ja":"コンピュータアーキテクチャ"},"credits":{"lecture":2.0,"exercise":1.0,"lab":0.0},"competencies":[1],"content":["a"],"note":"B群"},